;doc_id;relation;used;used_Felix;Anmerkung;ner;sentence;pre_sentence;post_sentence;section_name;section_index
68054;2bb9f0768fac9622a0be446df69daf75a954d5ac;Material;1;;1;LDC2014T12;1 ) JAMR flanigan - EtAl:2014:P14 - 1 , flanigan - EtAl:2016:SemEval and 2 ) CAMR and evaluate the final performances of the AMR parsers on both the newswire proportion and the entire dataset of LDC2014T12 .;For the extrinsic evaluation , we plug our alignment into two open - sourced AMR parsers :;We use the configuration in flanigan - EtAl:2016:SemEval for JAMR and the configuration in wang - xue - pradhan:2015:ACL - IJCNLP without semantic role labeling ( SRL ) features for CAMR .;Settings;17
9432;05357b8c05b5bc020e871fc330a88910c3177e4d;Material;1;;1;PASCAL VOC protocol;Average Precision ( AP ) and the mean of AP ( mAP ) is the evaluation metric to test our model on the testing set , which follows the standard PASCAL VOC protocol .;For testing , there are two metrics for evaluation : mAP and CorLoc .;Correct localization ( CorLoc ) is to test our model on the training set measuring the localization accuracy .;Datasets and evaluation measures;8
10344;060ff1aad5619a7d6d6cdfaf8be5da29bff3808c;Material;1;;1;CoNLL - 2012;subsubsection : CoNLL - 2012;We use the pre - trained ELMo models and learn task - specific combinations of the ELMo representations which are provided as input instead of GloVe embeddings to the D & M parser with otherwise default settings .;We follow the CoNLL - 2012 split used by he2018jointly to evaluate our models , which uses the annotations from here but the subset of those documents from the CoNLL - 2012 co - reference split described here pradhan2013towards .;CoNLL - 2012;20
13297;074b6fe0cc6848fb86a6703d1c52074494177c79;Material;na;kein Dataset name? -> na?;?;winter images;The subset of the dataset we use contains 13 classes and consists of 10 , 852 fall images and 7 , 654 winter images .;We use only the front - facing views in the sequences so as to mimic dashcam imagery , and adapt from fall to winter .;To further demonstrate our method ’s applicability to real - world adaptation scenarios , we also evaluate our model in a challenging synthetic - to - real adaptation setting .;Semantic Segmentation Adaptation;6
101655;42764b57d0794b63487a295ce8c07eeb6961477e;Material;1;;1;MS COCO segmentation dataset;We demonstrate excellent accuracy on the challenging MS COCO segmentation dataset using an extremely deep 101 - layer residual net ( ResNet - 101 ) , and also report our 1st - place result in the COCO segmentation track in ILSVRC & COCO 2015 competitions .;Thanks to the end - to - end training and the independence of external modules , the three sub - tasks and the entire system easily benefit from stronger features learned by deeper models .;;Introduction;1
23323;0ca2bd0e40a8f0a57665535ae1c31561370ad183;Material;1;?;1;enwik8;The Hutter Prize Wikipedia ( enwik8 ) dataset [ reference ] contains 205 symbols including XML markups and special characters .;Hutter Prize Wikipedia;We follow the data splits used in [ reference ] where the first 90 M characters are used to train the model , the next 5 M characters for validation , and the remainders for the test set .;Text8;10
65161;29c19276b8fff231717c3e342cb24144d2b77726;Material;0;;0;English;"They use a convolutional neural network ( CNN ; or convnet ) and evaluated their model on English ( PTB ) and Portuguese , showing that the model achieves state - of - the - art performance close to taggers using carefully designed feature templates .";For POS tagging , santos : zadrozny:2014 were the first to propose character - based models .;ling :;Related Work;11
91323;3b1b94441010615195a5c404409ce2416860508c;Material;na;kein Dataset name? -> na?;0;Large - scale Knowledge Bases;Large - scale Knowledge Bases ( KBs ) , such as Freebase and DBpedia , have been used successfully in several natural language Question Answering ( QA ) systems .;Our framework also exploits both CNN and RNNs , but in contrast to preceding approaches which use only image features extracted from a CNN in answering a question , we employ multiple sources , including image content , generated image captions and mined external knowledge , to feed to an RNN to answer questions .;However , VQA systems exploiting KBs are still relatively rare .;Visual Question Answering;5
47618;1c7e078611c9df412e6eb3a356f31a0da0c1f99c;Material;1;;1;YCB - Video;To thoroughly evaluate our method , we additionally collected a large scale RGB - D video dataset named YCB - Video , which contains 6D poses of 21 objects from the YCB object set in 92 videos with a total of 133 , 827 frames .;RGB - D pose estimation ( we use depth images in the Iterative Closest Point ( ICP ) algorithm for pose refinement ) .;Objects in the dataset exhibit different symmetries and are arranged in various poses and spatial configurations , generating severe occlusions between them .;INTRODUCTION;1
102947;432d8cba544bf7b09b0455561fea098177a85db1;Material;1;;1;youtube_faces;We use the Youtube Faces Database from youtube_faces .;Finally , we provide a proof of concept for generating faces of a particular person .;It contains videos of different people .;Youtube Faces;19
67129;2aec8d465e9a74c27f956ed1136f3e8a3ba0a833;Material;0;;0;Kodak24 dataset;The Kodak24 dataset consists of 24 center - cropped images of size 500 500 from the original Kodak dataset .;BSD68 dataset .;The McMaster dataset is a widely - used dataset for color demosaicing , which contains 18 cropped images of size 500 500 .;Dataset Generation and Network Training;14
67141;2aec8d465e9a74c27f956ed1136f3e8a3ba0a833;Material;na;;?;camera noise;We note that RNI6 and RNI15 cover a variety of real noise types , such as camera noise and JPEG compression noise .;The RNI15 dataset consists of 15 real noisy images .;Since the ground - truth clean images are unavailable for real noisy images , we thus only provide the visual comparisons on these images .;Dataset Generation and Network Training;14
85388;36911f5fc4f4eb1221f832114946de4773cf78e6;Material;1;;1;TREC - CAR;We follow the same procedure described for the MS MARCO dataset to fine - tune our models on TREC - CAR .;;However , there is an important difference .;Training;9
94329;3dd2f70f48588e9bb89f1e5eec7f0d8750dd920a;Material;1;;1;MS COCO dataset;We applied Fast R - CNN ( with VGG16 ) to the MS COCO dataset [ reference ] to establish a preliminary baseline .;;"We trained on the 80k image training set for 240k iterations and evaluated on the "" test - dev "" set using the evaluation server .";Preliminary MS COCO results;25
73013;2e4c06dd00c4c09ad5ac6be883cc66c19d88ea79;Material;1;;1;Metabolic;For the MF baseline , we closely follow the experimental protocol in , where we randomly sample 10 percent of the observed links for training and evaluate link prediction performance on the other disjoint 90 percent for the { Protein , Metabolic , Conflict } datasets .;We begin our empirical evaluation with the SDNE baseline , where we compare the representation capacity of our models on the network reconstruction task using the Arxiv - GRQC and BlogCatalog datasets .;For PowerGrid , we use 90 percent of observed links for training and evaluate on the remaining 10 percent .;Datasets and Baselines;7
80678;34a6762ed8e92612ba4fdf02ee95d2ee0d587908;Material;1;;1;DukeMTMC;We introduced two pipelines after ResNet , one is meant to work on Market1501 and the other works on DukeMTMC .;;Each pipeline consists of two convolutional blocks followed by a Fully connected layer .;Multiple Pipelines;5
92439;3c1d781f2dab8da12e3cb0e4d7abfb440a340a09;Material;0;;0;Flickr30k corpus;The premises are drawn from the Flickr30k corpus , and then the hypotheses are manually composed for each relationship class ( entailment , neutral , contradiction , and - ) .;The Stanford Natural Language Inference ( SNLI ) dataset contains human annotated sentence pairs .;The “ - ” class indicates that there is no consensus decision among the annotators , consequently , we remove them during the training and evaluation following the literature .;Dataset;9
21017;0b5aef2894d3248fb5ecc955d50501f0aa276036;Material;1;;1;IEMOCAP dataset;As the IEMOCAP dataset contains four distinct emotion categories , in the last layer of the network we used a softmax classifier whose output dimension is set to 4 .;;In order to perform classification on IEMOCAP dataset we feed the fused features ( where and ) to a softmax layer with outputs .;IEMOCAP;38
2490;0171bdeb1c6e333287be655c667cfba5edb89b76;Material;1;;1;5 K dataset;Our 5 K dataset is a subset of the full ImageNet - 22 K set [ reference ] .;Next we evaluate our models on a larger ImageNet subset that has 5000 categories .;The 5000 categories consist of the original ImageNet - 1 K categories and additional 4000 categories that have the largest number of images in the full ImageNet set .;Experiments on ImageNet - 5 K;13
26939;0ecd4fdce541317b38124967b5c2a259d8f43c91;Material;na;;?;7 - bit images;"Games can easily last 10 , 000 time steps ( compared to 200–1000 in other domains ) ; observations are composed of 7 - bit images ( compared to black and white images in the work of stober08pixels , or 5 - 6 input features elsewhere ) ; observations are also more complex , containing the two players ’ score and side walls .";The Atari 2600 Pong , however , is significantly more complex than Pong domains developed for research .;In sheer size , the Atari 2600 Pong is thus a larger domain .;Final Remarks;35
88196;380b2c78d21ae6c43d418b6f0cb0222d5293d345;Material;1;;1;Chinese CTB - 5;we report results in the English PTB and Chinese CTB - 5 .;lstmacl15;Table [ reference ] shows the results of the parser in its different configurations .;Experiments;7
44551;1a5ea605111eb3403868d4b679315e944beee8c6;Material;1;;1;Czech monolingual news2015;Then we continued training the model on a new parallel corpus , comprising 8.2 M sentences back - translated from the Czech monolingual news2015 , 5 copies of news - commentary v11 , and 9 M sentences sampled from Czeng 1.6pre .;This took approximately 1 M minibatches , or 3 weeks .;The model used for back - translation was a neural MT model from earlier experiments , trained on WMT15 data .;English Czech;10
18565;0a3a003457f5d7758a42a0e4b7278b39a86ed0bd;Material;na;;?;5 - shot;"Figure [ reference ] shows 1 ) MTL with HT meta - batch consistently achieves higher performances than MTL with the conventional meta - batch , in terms of the recognition accuracy in all settings ; and 2 ) it is impressive that MTL with HT meta - batch achieves top performances early , after about iterations for 1 - shot , for 5 - shot and for";Speed of convergence of HT meta - batch .;10 - shot , on the more challenging dataset – FC100 .;Results and analysis;12
31814;1023b20d226bd0af9fdf0fd1847accefbfa5ec84;Material;0;;0;CNN and Daily Mail news data;black Several large cloze - style context - question - answer datasets have been introduced recently : the CNN and Daily Mail news data and the Children ’s Book Test .;;Thanks to the size of these datasets , the associated text comprehension task is well suited for deep - learning techniques that currently seem to outperform all alternative approaches .;Text Understanding with the Attention Sum Reader Network;0
105972;4543052aeaf52fdb01fced9b3ccf97827582cef5;Material;1;;1;Leeds Sports Pose;We use two benchmark human pose estimation datasets : MPII Human Pose and Leeds Sports Pose ( LSP ) .;Human Pose Datasets .;The MPII is collected from YouTube videos with a broad range of human activities .;Experiments;9
86150;36a03f648b40d209ce361550dbe1c823ddb715b5;Material;1;?;1;HANDS 2017;The qualitative results of the V2V - PoseNet on the ICVL , NYU , MSRA , HANDS 2017 , ITOP front - view , and ITOP top - view datasets are shown in Figure 9 , 10 , 11 , 12 , 13 , and 14 , respectively .;As shown in Table 5 , the proposed system outperforms all the existing methods by a large margin in both of views , which indicates that our model can be applied to not only 3D hand pose estimation , but also other challenging problems such as 3D human pose estimation from the front - and top - views .;;Comparison with state - of - the - art methods;16
64622;289e91654f6da968d625481ef21f52892052d4fc;Material;1;;1;Kanshan - Cup dataset;We observed the following from the Table [ reference ] : Word - based models are better than char - based models in Kanshan - Cup dataset .;Table [ reference ] gives the performance of our model and baselines over two different datasets with respect to Precision , Recall@5 and .;That may be because in Chinese the words can offer more supervisions than characters and the question tagging task needs more word supervision .;Performance Comparison;24
66027;2a94c84383ee3de5e6211d43d16e7de387f68878;Material;1;;1;minival;More object detection results using Faster R - CNN and our FPNs , evaluated on minival .;In Ta - Table 5 .;Sharing features increases train time by 1.5× ( using 4 - step training [ reference ] ) , but reduces test time .;Faster R - CNN ( on consistent proposals );13
71522;2d876ed1dd2c58058d7197b734a8e4d349b8f231;Material;1;;1;IMDb movie review dataset;We evaluate the QRNN architecture on a popular document - level sentiment classification benchmark , the IMDb movie review dataset Maas2011 .;;The dataset consists of a balanced sample of 25 , 000 positive and 25 , 000 negative reviews , divided into equal - size train and test sets , with an average document length of 231 words Wang2012 .;Sentiment Classification;5
76583;303fef411f235e6d1125a40af1e93224f498a4d5;Material;1;;1;text8 dataset;We conduct experiments of CharLM using the text8 dataset mahoney2011large , which consists of 100 M characters including only alphabetical characters and spaces derived from Wikipedia .;Hence , we expect MoS to yield similar performance to Softmax on CharLM .;We follow mikolov2012subword and use the first 90 M characters for training , the next 5 M for validation and the final 5 M for testing .;An inverse experiment on character - level language modeling;33
94441;3e58fbb8cb96880e018ca18a60e2d86e3cb0c10a;Material;1;;1;extended PASCAL - Person - Part;Extensive experiments on MPII Human Pose Multi - Person , extended PASCAL - Person - Part and WAF benchmarks evidently show the efficiency and effectiveness of the proposed GPN .;We implement GPN based on the Hourglass network for learning joint detector and dense regressor , simultaneously .;Moreover , GPN achieves new state - of - the - art on all these benchmarks .;Introduction;1
36467;14ad9d060c1e8f0449e697ee189ac346353fbfbc;Material;1;;1;JNLPBA;The error analysis of our STM , which is a single BiLSTM - CRF model , shows that the majority of errors are classified as bio - entity errors which comprise up to 49.3 % of the total errors in JNLPBA .;Error analysis was conducted on models which showed best performance in our experiments .;According to the error analysis of our STM model , bio - entity errors constitute 1333 errors out of 4334 errors , comprising 30.8 % of all the errors .;Discussion;17
73415;2e57bccb74bcb46cbc5b4225b62679023ed1f9da;Material;1;;1;CNN and Daily Mail Datasets;section : CNN and Daily Mail Datasets;In this section , we evaluate the performance of ReasoNets in machine comprehension datasets , including unstructured CNN and Daily Mail datasets , the Stanford SQuAD dataset , and a structured Graph Reachability dataset .;We examine the performance of ReasoNets on CNN and Daily Mail datasets .;CNN and Daily Mail Datasets;7
100263;41d08fb733f3e50ac183490f84d6377dffccf350;Material;1;;1;3D - R2N2;On many categories our method even outperforms the 3D - R2N2 's prediction given 5 views .;3R - R2N2 is also able to predict 3D shapes from more than one views .;To further contrast the two methods , we visualize some typical examples .;3D Shape Reconstruction from RGB Images;13
2971;01959ef569f74c286956024866c1d107099199f7;Material;na;;?;abstract scenes;"We collected a new dataset of "" realistic "" abstract scenes to enable research focused only on the high - level reasoning required for VQA by removing the need to parse real images .";The MS COCO dataset has images depicting diverse and complex scenes that are effective at eliciting compelling and diverse questions .;Three questions were collected for each image or scene .;INTRODUCTION;2
96826;3febb2bed8865945e7fddc99efd791887bb7e14f;Material;na;;?;unlabeled data;In contrast , after pretraining the biLM with unlabeled data , we fix the weights and add additional task - specific model capacity , allowing us to leverage large , rich and universal biLM representations for cases where downstream training data size dictates a smaller supervised model .;Dai2015SemisupervisedSL and Ramachandran2017ImproveSeq2SeqLMGal2016ATG pretrain encoder - decoder pairs using language models and sequence autoencoders and then fine tune with task specific supervision .;;Related work;2
40463;16cd50316e41cbb1d9dfeafeb524b31654cef37a;Material;0;;0;Wall Street Journal task;"In the area of speech recognition , much of the pioneering early work was driven by a series of carefully designed tasks with DARPA - funded datasets publicly released by the LDC and NIST : first simple ones like the “ resource management ” task with a small vocabulary and carefully controlled grammar ; then read speech recognition in the Wall Street Journal task ; then Broadcast News ; each progressively more difficult for automatic systems .";Recent years have seen human performance levels reached or surpassed in tasks ranging from the games of chess and Go to simple speech recognition tasks like carefully read newspaper speech and rigidly constrained small - vocabulary tasks in noise .;One of last big initiatives in this area was in conversational telephone speech ( CTS ) , which is especially difficult due to the spontaneous ( neither read nor planned ) nature of the speech , its informality , and the self - corrections , hesitations and other disfluencies that are pervasive .;Introduction;1
26633;0ecd4fdce541317b38124967b5c2a259d8f43c91;Material;na;;?;video games;The console ’s joystick , as well as some of the original games such as Adventure and Pitfall ! , are iconic symbols of early video games .;"Over 500 original games were released for the console ; “ homebrew ” games continue to be developed today , over thirty years later .";Nearly all arcade games of the time – Pac - Man and;The Atari 2600;3
45695;1b29786b7e43dda1a4d6ee93f520a2960b1e3126;Material;na;;?;question - answer pairs;Using similar resources as the dialog dataset of , our new benchmark WikiMovies addresses both deficiencies by providing a substantial corpus of question - answer pairs that can be answered by either using a KB or a corresponding set of documents .;Unfortunately , these datasets are very small ( hundreds of examples ) and , because of their answer selection setting , do not offer the option to directly compare answering from a KB against answering from pure text .;Even though standard pipeline QA systems like AskMR have been recently revisited , the best published results on TrecQA and WikiQA have been obtained by either convolutional neural networks or recurrent neural networks —both usually with attention mechanisms inspired by .;Related Work;2
65172;29c19276b8fff231717c3e342cb24144d2b77726;Material;0;;0;WSJ;ea:2015:arxiv , however , they only explore word embeddings , orthographic information and evaluate on WSJ only .;Bi - LSTMs for POS tagging are also reported in wang :;A related study is cheng : fang : ostendorf:2015 who propose a multi - task RNN for named entity recognition by jointly predicting the next token and current token ’s name label .;Related Work;11
102038;42e80c73867bff9eaff6beceb8730fc1276283b9;Material;1;;1;2014 / 2016 French - English;2014 / 2016 French - English and German - English show the effectiveness of our approach , as our proposed system outperforms the previous state - of - the - art in unsupervised machine translation by 5 - 7 BLEU points in all these datasets and translation directions .;Our experiments on WMT;Our system also outperforms the supervised WMT 2014 shared task winner in English - to - German , and is around 2 BLEU points behind it in the rest of translation directions , suggesting that unsupervised machine translation can be a usable alternative in practical settings .;Introduction;1
85300;3652c2d20f198dc39ad159eba55d08341c56d628;Material;1;;1;STL10;We show that mixing the ideas of these two concepts is fruitful , since we achieve near state - of - the - art performance on several datasets such as MNIST , CIFAR - 10 , and STL10 , with simple architectures and no data augmentation .;In this paper , we have proposed a new methodology for combining kernels and convolutional neural networks .;Some challenges regarding our work are left open for the future .;Conclusion;26
97713;40193e7ba0fbd7153a1fe15e95563463b67c71f3;Material;1;;1;AFLW2000 - 3D.;AFLW2000 - 3D. As can be seen , the 3D reconstruction results of 2DASL outperforms 3DDFA by 0.39 , and 2.29 for DeFA , which are significant improvements .;7 ( a ) shows the comparison results on;We show some visual results of our 2DASL and compare with PRNet and VRN - Guided in Fig .;3D face reconstruction;16
63723;27e4b65121d3c88643d86dc91a9bdafdf223b988;Material;0;;0;DUC - 2003;The task of abstractive summarization has been standardized using the DUC - 2003 and DUC - 2004 competitions .;As such , human summaries are abstractive in nature and seldom consist of reproduction of original sentences from the document .;The data for these tasks consists of news stories from various topics with multiple reference summaries per story generated by humans .;Related Work;7
81385;34f63959ea4a13a05948274a1558c6854a051150;Material;0;;0;STS - B;paragraph : STS - B;Accuracy is used as the evaluation metric .;The Semantic Textual Similarity Benchmark is a collection of sentence pairs collected from multiple data resources including news headlines , video , and image captions , and NLI data .;STS - B;19
58839;23dcfda130aada27c158c0b5f394cac489c9c795;Material;0;;0;AFW;AFW is a popular dataset , also commonly used to test landmark detection , which contains rough pose annotations .;Results can be seen in Table [ reference ] .;It contains 468 in - the - wild faces with absolute yaw degree;AFLW and AFW Benchmarking;12
59779;2451db113552afb6d9ad15ef4009ec4133d28f74;Material;1;;1;Stanford cars;For fine - grained categorization , we use three popular fine - grained benchmarks , i.e. , CUB - 200 - 2011 ( Birds ) , FGVC - aircraft ( Aircrafts ) and Stanford cars ( Cars ) .;As in , we report the results on the validation set .;The Birds dataset contains 11 , 788 images from 200 species , with large intra - class variation but small inter - class variation .;Datasets and Our Meta - layer Implementation;13
45923;1b29786b7e43dda1a4d6ee93f520a2960b1e3126;Material;1;;1;WikiQA;"Note that this is much larger than most existing datasets ; for example , the WikiQA dataset for which we also conduct experiments in Sec .";The same question ( even worded differently ) can not appear in both train and test sets .;[ reference ] has only 1000 training pairs .;Question - Answer Pairs;16
102927;432d8cba544bf7b09b0455561fea098177a85db1;Material;1;;1;OMNIGLOT;In Figure [ reference ] we show two examples of few - shot learning by conditioning on samples of unseen characters from OMNIGLOT , and conditioning on samples of digits from MNIST .;The decoder used a Bernoulli likelihood .;The samples are mostly of a high - quality , and this shows that the neural statistician can generalize even to new datasets .;Omniglot;18
50668;1e7678467b1807777dcd9be557b79328ce9419a8;Material;1;;1;YFCC100 M large - scale collection of unlabelled images;We add 10 K distractor images randomly sampled from the YFCC100 M large - scale collection of unlabelled images .;We also report the performance of our network in a copy detection setting , indicating the mean average precision on the “ strong ” subset of the INRIA Copydays dataset .;We call the combination C10k .;Datasets .;27
83388;35c1668dc64d24a28c6041978e5fcca754eb2f4b;Material;1;;;German - English machine translation track;We use data from the German - English machine translation track of the IWSLT 2014 evaluation campaign cettolo2014 .;For the translation task , our generative model is an LSTM with hidden units and it uses the same attentive encoder architecture as the one used for summarization .;The corpus consists of sentence - aligned subtitles of TED and TEDx talks .;Machine Translation;13
101135;424561d8585ff8ebce7d5d07de8dbf7aae5e7270;Material;1;;;union set of PASCAL VOC 2007 trainval;We further train the RPN and detection network on the union set of PASCAL VOC 2007 trainval and 2012 trainval .;For the feature - shared variant , the result is 69.9%—better than the strong SS baseline , yet with nearly cost - free proposals .;The mAP is 73.2 % .;Experiments on PASCAL VOC;11
91244;3b1b94441010615195a5c404409ce2416860508c;Material;na;;;human readable text;converted image parsing results into a semantic representation in the form of Web Ontology Language , which is converted to human readable text .;Zhu et al .;A more sophisticated CRF - based method use of attribute detections beyond triplets was proposed by Kulkarni et al .;Image Captioning;4
13049;072fd0b8d471f183da0ca9880379b3bb29031b6a;Material;1;;;Cityscapes training set;Cityscapes labels→photo 2975 training images from the Cityscapes training set , trained for 200 epochs , with random jitter and mirroring .;Weights were initialized from a Gaussian distribution with mean 0 and standard deviation 0.02 .;We used the Cityscapes validation set for testing .;Training details;24
