;doc_id;relation;used;used_Felix;Anmerkung;ner;sentence;pre_sentence;post_sentence;section_name;section_index
2897;01959ef569f74c286956024866c1d107099199f7;Material;1;;;multiple - choice - real;Screenshots of leaderboards for open - ended - real and multiple - choice - real are shown in Fig . 13 .;| mc - abstract ] . 2 ) Compare their test - standard accuracies with those on the corresponding test2015 leaderboards [ oe - real - leaderboard | oe - abstract - leaderboard | mc - real - leaderboard | mcabstract - leaderboard ] . For more details , please see the challenge page [ reference ] .;We also compare the test - standard accuracies of our best model ( deeper LSTM Q + norm I ) for both open - ended and multiple - choice tasks ( real images ) with other entries ( as of October 28 , 2016 ) on the corresponding leaderboards in Table 5 .;VQA CHALLENGE AND WORKSHOP;17
53270;20cc4bfdb648fd7947c71252589fc867d4d16933;Material;1;;;CUB - 200 - 2011 dataset;We conduct this experiment for four different models : GoogLeNet [ reference ] , ResNet - 50 [ reference ] and VGGNet - 16 [ reference ] and Bilinear - CNN [ reference ] on the CUB - 200 - 2011 dataset .;Choice of Hyperparameter λ : Since our formulation requires the selection of a hyperparameter λ , it is important to study the sensitivity of classification performance to the choice of λ .;PC 's performance is not very sensitive to the choice of λ ( Figure 2 and Supplementary Tables S1 - S5 ) .;Fine - Grained Visual Classification;13
86172;36a03f648b40d209ce361550dbe1c823ddb715b5;Material;1;;;ITOP datasets;Note that our model outperforms previous works by a large margin without epoch ensemble on the ICVL , NYU , MSRA , and ITOP datasets while running in real - time using a single GPU .;The next step is network forwarding , which takes 5 ms and takes 0.5 ms to extract 3D coordinates from the 3D heatmap .;;Computational complexity;17
71033;2d5dba33c706d907733f15e7b57fde9909894e29;Material;1;;;IC15;We mix the training set of TD500 with the training set of IC15 , in the way that every batch has half of its images coming from each dataset .;The training set of TD500 only has 300 images , which are not enough for finetuning our model .;The pretrained model is finetuned for k iterations .;Detecting Multi - Lingual Text in Long Lines;26
54074;218b80da3eb15ae35267d280dcc4a806d515334a;Material;1;;;Cambridge Learner Corpus;As previous studies ji2017nested , we use the public Lang - 8 Corpus mizumoto2011mining , tajiri2012tense , Cambridge Learner Corpus ( CLC ) nicholls2003cambridge and NUS Corpus of Learner English ( NUCLE ) dahlmeier2013building as our original error - corrected training data .;;Table [ reference ] shows the stats of the datasets .;Dataset and evaluation;12
28082;0f0cab9235bbf185acdd4f9713fd111ca50effca;Material;1;;;RAF ) dataset;For comparing our deep learning architectures for image - based facial expression recognition against standard results , we use Static Facial Expressions in the Wild ( SFEW ) 2.0 dataset and Real - world Affective Faces ( RAF ) dataset .;;SFEW 2.0 contains 1394 images , of which 958 are to be used for training and 436 for validation .;Image - based Facial Expression Recognition;16
27534;0ee850dd6640a96531ac5ad21da5438db04d8b3c;Material;1;;;Robust04;We used over six million queries to train our models and evaluated them on Robust04 and ClueWeb;We examine various neural ranking models with different ranking architectures and objectives , and different input representations .;09 - Category B collections , in an ad - hoc retrieval setting .;Conclusions;13
74117;2ebfc12285f5d426e0d0e8d2befa1af27f99a56e;Material;0;;;PASCAL - VOC - 2011 segmentation dataset;SYM - PASCAL is derived from the PASCAL - VOC - 2011 segmentation dataset and targets object symmetry detection in the wild .;It is split into 228 train images and 100 test images .;It consists of 648 train images and 787 test images .;Dataset and evaluation protocol;9
14821;0891ed6ed64fb461bc03557b28c686f87d880c9a;Material;1;;;CoNLL - 2003 datasets;’s ability to generalize to different languages , we present results on the CoNLL - 2002 and CoNLL - 2003 datasets that contain independent named entity labels for English , Spanish , German and Dutch .;To demonstrate our model;All datasets contain four different types of named entities : locations , persons , organizations , and miscellaneous entities that do not belong in any of the three previous categories .;Data Sets;16
26515;0e8753f550350e53824358ca3f0f8cfd2f2dc2f7;Material;1;;1;MovieLens 10 M dataset;We work with the widely used MovieLens 10 M dataset , containing ratings ( ‘ stars ’ ) from to ( increments of ) given by 71 , 567 users for 10 , 677 movies .;In this section , we report experiments on real data , which appear consistent with the results on the aforementioned artificial data .;The density of the observations is .;Movielens dataset;9
88212;380b2c78d21ae6c43d418b6f0cb0222d5293d345;Material;1;;1;CoNLL 2009 shared task;In order to be able to compare with similar greedy parsers we report the performance of the parser on the multilingual treebanks of the CoNLL 2009 shared task .;Flattening the sampling distribution ( ) is especially beneficial when training with pretrained word embeddings .;Since some of the treebanks contain nonprojective sentences and arc - hybrid does not allow nonprojective trees , we use the pseudo - projective approach .;Experiments;7
34201;12e20e4ea572dbe476fd894c5c9a9930cf250dd2;Material;0;;0;Stanford Question Answering dataset;Recently , released the Stanford Question Answering dataset ( SQuAD ) , which is almost two orders of magnitude larger than all previous hand - annotated datasets .;However , these datasets are either not large enough to support deep neural network models or too easy to challenge natural language .;Moreover , this dataset consists 100 , 000 + questions posed by crowdworkers on a set of Wikipedia articles , where the answer to each question is a segment of text from the corresponding passage , rather than a limited set of multiple choices or entities .;Machine Reading Comprehension Dataset .;17
94393;3e58fbb8cb96880e018ca18a60e2d86e3cb0c10a;Material;1;;0;MPII Human Pose Multi - Person;Extensive experiments on benchmarks MPII Human Pose Multi - Person , extended PASCAL - Person - Part , and WAF , show the efficiency of GPN with new state - of - the - art performance .;GPN is implemented with the Hourglass architecture as the backbone network to simultaneously learn joint detector and dense regressor .;;Generative Partition Networks for Multi - Person Pose Estimation;0
67266;2aec8d465e9a74c27f956ed1136f3e8a3ba0a833;Material;1;kein dataset;na;Real Noisy Images;subsection : Experiments on Real Noisy Images;When the ground - truth noise level is unknown , it is more preferable to set a larger input noise level than a lower one to remove noise with better perceptual quality .;In this subsection , real noisy images are used to further assess the practicability of FFDNet .;Experiments on Real Noisy Images;18
85387;36911f5fc4f4eb1221f832114946de4773cf78e6;Material;0;kein dataset;1;English Wikipedia paragraphs;The corpus consists of all of the English Wikipedia paragraphs , except the abstracts .;The relevant passages are the paragraphs within that section .;The released dataset has five predefined folds , and we use the first four as a training set ( approximately 3 M queries ) , and the remaining as a validation set ( approximately 700k queries ) .;TREC - CAR;8
91451;3b1b94441010615195a5c404409ce2416860508c;Material;0;kein dataset;na;scale knowledge base;The third input source is the textual knowledge which is mined from a large - scale knowledge base , the DBpedia .;Average - pooling is applied over the 5 hidden - state vectors , to obtain a vector representation for the image .;More details are shown in the following section .;A VQA Model with External Knowledge;9
58647;23dcfda130aada27c158c0b5f394cac489c9c795;Material;0;;0;AFLW dataset;presents an in - depth study of relatively shallow networks trained using a regression loss on the AFLW dataset .;Also recently , work has developed on estimating head pose using neural networks .;In KEPLER the authors present a modified GoogleNet architecture which predicts facial keypoints and pose jointly .;RELATED WORK;2
33212;1109b663453e78a59e4f66446d71720ac58cec25;Material;1;;1;ImageNet 2012 training set;We train the network on the ImageNet 2012 training set ( 1.2 million images and classes ) .;;Our model uses the same fixed input size approach proposed by Krizhevsky et al .;Model Design and Training;4
97666;40193e7ba0fbd7153a1fe15e95563463b67c71f3;Material;0;kein dataset;na;"in - the - wild "" images";"This is mainly because 2DASL involves a number of the "" in - the - wild "" images for training , enabling the model to perform well in cases even unseen in the 3D annotated training data .";Although all the state - of - the - art methods of dense face alignment conduct evaluation on AFLW2000 - 3D , the ground truth of AFLW2000 - 3D is controversial [ reference ][ reference ] , since its annotation pipeline is based on the Landmarks Marching method in [ reference ] . As can be seen , our results are more accurate than the ground truth in some cases .;For fair comparison , we adopt the normalized mean error ( NME ) [ reference ] as the metric to evaluate the alignment performance .;Dense face alignment;15
98443;40b4596a0ae4f4ff065f3f13f36db39543e50068;Material;1;;1;Cityscapes datset;We conduct extensive experiments by using the GTAV dataset and the Cityscapes datset .;The two modules above can be easily integrated with existing state - of - the - art semantic segmentation networks to boost their generalizability when adapting from synthetic to real urban scenes .;Our proposed method achieves a new state - of - the - art of mean IoU.;Introduction;1
101913;42764b57d0794b63487a295ce8c07eeb6961477e;Material;1;?;1;2012 trainval;Finally , we train the MNC model on the union set of 2007 trainval + test and 2012 trainval .;Using these box layers ’ outputs ( box coordinates and scores ) in place of the mask - level outputs , we obtain an mAP of 73.5 % ( Table [ reference ] ) .;As the 2007 set has no mask - level annotation , when a sample image from the 2007 set is used , its mask regression loss is ignored ( but the mask is generated for the later stages ) and its mask - level IoU measure for determining positive / negative samples is ignored .;Experiments on PASCAL VOC 2012;11
101906;42764b57d0794b63487a295ce8c07eeb6961477e;Material;0;;0;2007 set;We note that our result is obtained with fewer training images ( without the 2007 set ) , but with mask - level annotations .;Table [ reference ] shows that our result ( 70.9 % ) compares favorably to the recent Fast / Faster R - CNN systems .;This experiment shows the effectiveness of our algorithm for detecting both box - and mask - level instances .;Experiments on PASCAL VOC 2012;11
75840;302207c149bdf7beb6e46e4d4afbd2fa9ac02c64;Material;1;;0;Radboud Faces Database;The Radboud Faces Database ( RaFD ) consists of 4 , 824 images collected from 67 participants .;RaFD .;Each participant makes eight facial expressions in three different gaze directions , which are captured from three different angles .;Datasets;9
1745;01125e3c68edb420b8d884ff53fb38d9fbe4f2b8;Material;0;;1;Florence;To measure the effect of facial expressions on performance , we rendered frontal images in difference expressions from BU - 4DFE ( since Florence only exhibits a neutral expression ) and measured the performance for each expression .;Certain expressions are usually considered harder to accurately reproduce in 3D face reconstruction .;This kind of extreme acted facial expressions generally do not occur in the training set , yet as shown in Fig .;Ablation studies;11
53827;2116b2eaaece4af9c28c32af2728f3d49b792cf9;Material;1;;1;CIFAR - 10 without dropout;Our model for CIFAR - 10 without dropout is a CNN with three convolutional layers .;;Pooling layers follow all three .;Models for CIFAR - 10;20
65163;29c19276b8fff231717c3e342cb24144d2b77726;Material;0;;0;Portuguese;"They use a convolutional neural network ( CNN ; or convnet ) and evaluated their model on English ( PTB ) and Portuguese , showing that the model achieves state - of - the - art performance close to taggers using carefully designed feature templates .";For POS tagging , santos : zadrozny:2014 were the first to propose character - based models .;ling :;Related Work;11
12281;06c5b86b638b2f3572b9cdd9ef0be4740b16781b;Material;1;;1;SST datasets;Our model has robust superiority over competitors and sets state - of - the - art on MR and SST datasets .;We summarize the experimental results in Table red [ reference ] .;First , our model brings a substantial improvement over the methods that do not leverage sentiment linguistic knowledge ( e.g. , RNTN , LSTM , BiLSTM , CNN and ID - LSTM ) on both datasets .;Experiment Results;10
2046;0116899fce00ffa4afee08b505300bb3968faf9f;Material;1;;1;COCO Dataset;Note that the COCO Dataset is not a long text dataset , in which most sentences are of about 10 words .;We take the image captions as the text to generate .;Thus we apply some preprocessing on the dataset .;Middle Text Generation : COCO Image Captions;13
6538;03a5b2aac53443e6078f0f63b35d4f95d6d54c5d;Material;1;;1;BSD datasets;’s run time on Set14It should be noted our results outperform all other algorithms in accuracy on the larger BSD datasets .;In this section , we evaluated our best model;However , the use of Set14 on a single CPU core is selected here in order to allow a straight - forward comparison with results from previous published results [ ] .;Run time evaluations;14
33375;1109b663453e78a59e4f66446d71720ac58cec25;Material;1;;1;ImageNet 2012;These were never addressed in and thus we are the first to explain how this can be done in the context of ImageNet 2012 .;A second important contribution of our paper is explaining how ConvNets can be effectively used for detection and localization tasks .;The scheme we propose involves substantial modifications to networks designed for classification , but clearly demonstrate that ConvNets are capable of these more challenging tasks .;Discussion;15
91785;3b1d8eb163ffff598c2faa0d9d7cf933857a359f;Material;0;;0;conf / emnlp / BowmanAPM15;More recently the availability of much larger annotated data , e.g. , SNLI DBLP : conf / emnlp / BowmanAPM15 and MultiNLI DBLP : journals / corr / WilliamsNB17 , has made it possible to train more complex models .;Early research on natural language inference and recognizing textual entailment has been performed on relatively small datasets ( refer to MacCartneyThesis for a good literature survey ) , which includes a large bulk of contributions made under the name of RTE , such as Dagan2005ThePR , Iftene : W07 - 1421 , among many others .;These models mainly fall into two types of approaches : sentence - encoding - based models and models using also inter - sentence attention .;Related Work;2
97737;40193e7ba0fbd7153a1fe15e95563463b67c71f3;Material;0;kein dataset;na;RGB face images;"In this section , we perform ablation study on AFLW2000 - 3D by evaluating several variants of our model : ( 1 ) 2DASL ( base ) , which only takes the RGB images as input without self - supervision and self - critic supervision ; ( 2 ) 2DASL ( cyc ) , which takes as input the combination of RGB face images and the corresponding 2D FLMs with self - supervison , however without self - critic supervision ; ( 3 ) 2DASL ( sc ) , which takes as input the RGB face images only using self - critic learning .";;( 4 ) 2DASL ( cyc + sc ) , which contains both self - supervision and self - critic supervision .;Ablation study;17
81381;34f63959ea4a13a05948274a1558c6854a051150;Material;1;;0;SST - 2;paragraph : SST - 2;It uses Matthews correlation coefficient as the evaluation metric .;The Stanford Sentiment Treebank is to determine the sentiment of sentences .;SST - 2;18
83390;35c1668dc64d24a28c6041978e5fcca754eb2f4b;Material;0;kein dataset;na;sentence - aligned subtitles of TED;The corpus consists of sentence - aligned subtitles of TED and TEDx talks .;We use data from the German - English machine translation track of the IWSLT 2014 evaluation campaign cettolo2014 .;We pre - process the training data using the tokenizer of the Moses toolkit koehn2007 and remove sentences longer than words as well as casing .;Machine Translation;13
92532;3c1d781f2dab8da12e3cb0e4d7abfb440a340a09;Material;1;;0;multinli;This design is inspired by the reported annotation tags in multinli .;To qualitatively evaluate the performance of our models , we design a set of annotation tags that can be extracted automatically .;The specifications of our annotation tags are as follows :;Analysis;15
8745;052443e1709c0f7d3432cca7c451534eea76b7ca;Material;1;;1;B100;We validate our seven techniques on standard SR benchmarks ( i.e. Set5 , Set14 , B100 ) and methods ( i.e. A + , SR - CNN , ANR , Zeyde , Yang ) and achieve substantial improvements .;: 1 ) augmentation of data , 2 ) use of large dictionaries with efficient search structures , 3 ) cascading , 4 ) image self - similarities , 5 ) back projection refinement , 6 ) enhanced prediction by consistency check , and 7 ) context reasoning .;The techniques are widely applicable and require no changes or only minor adjustments of the SR methods .;Abstract;1
107752;46018a894d533813d67322827ca51f78aed6d59e;Material;1;;1;BRATS 2015 challenge;Using our best performing method , we took part in the BRATS 2015 challenge .;However , their method is very similar to the LocalPathCNN which , according to our experiments , has worse performance .;The BRATS 2015 training dataset comprises of 220 subjects with high grade and 54 subjects with low grade gliomas .;Cascaded architectures;15
5346;02e85d62fbd8249a046d00ac10e39546511b2a51;Material;1;;1;BRATS );For brain tumors , we evaluate our system on the data from the 2015 Brain Tumor Segmentation Challenge ( BRATS ) ( ) .;;The training set consists of 220 cases with high grade ( HG ) and 54 cases with low grade ( LG ) glioma for which corresponding reference segmentations are provided .;Material and Pre - Processing;22
99476;41232a69c0f8d4b993e6c6e00b16c223442c962f;Material;1;;1;Gigaword benchmark;Experiments on the Gigaword benchmark demonstrate that our model greatly reduce fake summaries by 80 % .;Then , we propose the dual - attention s2s framework to force the generation conditioned on both source sentence and the fact descriptions .;In addition , since the fact descriptions often condense the meaning of the sentence , the import of them also brings significant improvement on informativeness .;Conclusion and Future Work;17
5378;02e85d62fbd8249a046d00ac10e39546511b2a51;Material;1;;1;BRATS test data;Table [ reference ] shows the results of our method on the BRATS test data .;DeepMedic behaves very well in preserving the hierarchical structure of the tumor , which we account to the large context processed by our multi - scale network .;Results of other submissions are not accessible .;Results;24
81359;34f63959ea4a13a05948274a1558c6854a051150;Material;1;;1;SciTail;We evaluate the proposed MT - DNN on three popular NLU benchmarks : GLUE , Stanford Natural Language Inference ( SNLI ) , and SciTail .;;We compare MT - DNN with existing state - of - the - art models including BERT and demonstrate the effectiveness of MTL for model fine - tuning using GLUE and domain adaptation using SNLI and SciTail .;Experiments;15
96453;3f45d73a7b8d10a59a68688c11950e003f4852fc;Material;1;;1;Retinex images;With the Retinex images , we apply the HSV color histogram to extract color features .;This makes person re - identification easier than using the original images .;In addition to color description , we also apply the Scale Invariant Local Ternary Pattern ( SILTP ) descriptor for illumination invariant texture description .;Dealing with Illumination Variations;4
79874;33a8d0a35390fde736744d4a0dd20dff7961c777;Material;1;;1;IMDB - MULTI;In second round , we used social network datasets namely : COLLAB , IMDB - BINARY , IMDB - MULTI , REDDIT - BINARY and REDDIT - MULTI - 5K. D & D dataset contains enzymes and non - enzymes proteins structures .;In first round , we used bioinformatics datasets namely : PTC , PROTEINS , NCI1 , NCI109 , D & D , and ENZYMES .;For other datasets details can be found in .;Experiment and Results;12
11408;063ad0349f05c8aacbbb653ffcf01047a293fa30;Material;1;;1;SentiHood dataset;As a testbed for this task , we introduce the SentiHood dataset , extracted from a question answering ( QA ) platform where urban neighbourhoods are discussed by users .;In particular , we identify the sentiment towards each aspect of one or more entities .;In this context units of text often mention several aspects of one or more neighbourhoods .;SentiHood : Targeted Aspect Based Sentiment Analysis Dataset for Urban Neighbourhoods;0
73205;2e4c06dd00c4c09ad5ac6be883cc66c19d88ea79;Material;0;kein dataset;na;Conflict;The datasets are summarized in Table [ reference ] and include networks for Protein interactions , Metabolic pathways , military Conflict between countries , the U.S. PowerGrid , collaboration between users on the BlogCatalog social website , and publication citations from the Cora , Citeseer , Pubmed , Arxiv - GRQC databases .;We evaluate our proposed autoencoder models on nine graph - structured datasets , spanning multiple application domains , from which previous graph embedding methods have achieved strong results for LPNC .;{ Protein , Metabolic , Conflict , PowerGrid } are reported in .;Datasets and Baselines;7
86582;36c3972569a6949ecca90bfa6f8e99883e092845;Material;0;;0;VQA 2.0 test - std split;Their performance reached 70.34 % on VQA 2.0 test - std split with an ensemble of 30 models trained with different seeds .;Multi - modal fusion is done through a simple Hadamard product followed by a multi - label classifier using a sigmoid activation function to predict the answer scores .;"For presentation clarity , we present our proposed changes ( and the respective improvements ) in a sequence ; however , we also found them to be independently useful .";Bottom - Up and Top - Down Attention;2
91600;3b1b94441010615195a5c404409ce2416860508c;Material;1;;1;VQA test split;The human ground truth answers for the actual VQA test split are not available publicly and only can be evaluated via the VQA evaluation server .;We randomly choose 5000 images from the validation set as our val set , with the remainder testing .;Hence , we also apply our final model on a test split and report the overall accuracy .;Evaluation on Visual Question Answering;17
40862;16cd50316e41cbb1d9dfeafeb524b31654cef37a;Material;0;kein dataset;na;vocalized - noise;The phonetic inventory includes special models for noise , vocalized - noise , laughter and silence .;Additionally , we have trained several models with 27k tied states .;We use a 30k - vocabulary derived from the most common words in the Switchboard and Fisher corpora .;Acoustic Model Details;21
2882;01959ef569f74c286956024866c1d107099199f7;Material;1;;1;VQA train + val dataset;": We created a filtered version of the VQA train + val dataset in which we only keep the answers with subject confidence "" yes "" .";Filtered Dataset;"Also , we keep only those questions for which at least 50 % ( 5 out of 10 ) answers are annotated with subject confidence "" yes "" .";4 ) K = 2000 :;16
96952;3febb2bed8865945e7fddc99efd791887bb7e14f;Material;0;kein dataset;na;domain specific data;In some cases , fine tuning the biLM on domain specific data leads to significant drops in perplexity and an increase in downstream task performance .;Once pretrained , the biLM can compute representations for any task .;This can be seen as a type of domain transfer for the biLM .;Pre - trained bidirectional language model architecture;7
71225;2d83dbf4c8eabc6bdef3326c4a30d5f33ffc944e;Material;0;;0;MS - COCO dataset;The images come from the MS - COCO dataset , 123 , 287 of them for training and validation , and 81 , 434 for test .;Table [ reference ] shows that Other type has the most benefit from Multiple - Choice .;The images are carefully collected to contain multiple objects and natural situations , which is also valid for visual question - answering tasks .;Visual QA Dataset;9
77656;31ae4873da19b1e28eca8787a17f49bba08627e5;Material;1;;1;trainval35k ’ set;For the COCO dataset , we use the ‘ trainval35k ’ set for training and the ‘ minival ’ set for testing .;MS COCO .;During training the Fast - RCNN , we apply SGD with 320 K iterations .;Experimental settings;11
2314;0171bdeb1c6e333287be655c667cfba5edb89b76;Material;1;;1;ImageNet classification dataset;Our neural networks , named ResNeXt ( suggesting the next dimension ) , outperform ResNet - 101 / 152 [ reference ] , ResNet - 200 [ reference ] , Inception - v3 [ reference ] , and Inception - ResNet - v2 [ reference ] on the ImageNet classification dataset .;Experiments demonstrate that increasing cardinality is a more effective way of gaining accuracy than going deeper or wider , especially when depth and width starts to give diminishing returns for existing models .;In particular , a 101 - layer ResNeXt is able to achieve better accuracy than ResNet - 200 [ reference ] but has only 50 % complexity .;Introduction;2
