;doc_id;relation;used;used_Felix;Anmerkung;ner;sentence;pre_sentence;post_sentence;section_name;section_index
18856;0a49b4de21363d86599d4a058aaf4f5aed019495;Material;1;;;WMT’15;We evaluate neural machine translation models with a character - level decoder on four language pairs from WMT’15 to make our evaluation as convincing as possible .;To answer this question , we focus on representing the target side as a character sequence .;We represent the source side as a sequence of subwords extracted using byte - pair encoding from sennrich2015neural , and vary the target side to be either a sequence of subwords or characters .;Introduction;1
11786;06b4d8409837dce9d6eb919efd1debdaecc40d01;Material;1;;;MINIST;Overall , we observe state - of - the - art classification error in all four datasets ( without data augmentation ) , for MINIST , for CIFAR - 10 , for CIFAR - 100 , and for SVHN ( for CIFAR - 10 with data augmentation ) .;"The performance gain is more evident in presence of small training data ( see Figure ( [ reference ] .b ) ) ; this might partially ease the burden of requiring large training data for DL .";All results are achieved without using averaging , which is not exclusive to our method .;Experiments;10
66486;2ad7cef781f98fd66101fa4a78e012369d064830;Material;0;kein dataset;;IJB - A.;IJB - A. This is because the face variations in this dataset are relatively small ( compare the examples in Fig . 6;The gaps between NAN and the best - performing baselines are smaller compared to the results on;and Fig .;High weight Low weight;18
89283;39978ba7c83333475d6825d0ff897692933895fc;Material;1;;;VOC 2012 training dataset;The VOC 2012 training dataset therefore helps our model learn this task effectively .;This can be understood because the primary advantage of our model comes from delineating the objects and improving fine segmentation boundaries .;The results of this experiment are shown in Table 2 , below the bar , and we see that our approach sets a new state - of - the - art on the VOC 2012 dataset .;Pascal VOC Datasets;18
87343;372bc106c61e7eb004835e85bbfee997409f176a;Material;1;;;Faces;Faces : We applied CoGAN to learn a joint distribution of face images with different .;We note that for the case that the supports of the two domains are different such as the color and depth image domains , the conditional model can not even be applied .;We trained several CoGANs , each for generating a face with an attribute and a corresponding face without the attribute .;Experiments;4
56891;231af7dc01a166cac3b5b01ca05778238f796e41;Material;0;;;bedrooms category;The Large - scale CelebFaces Attributes ( CelebA ) dataset , aligned and cropped , the training dataset of the bedrooms category of the large scale image database ( LSUN ) , the CIFAR - 10 training dataset , the Street View House Numbers training dataset ( SVHN ) , and the One Billion Word Benchmark .;We used the following datasets to evaluate GANs :;All experiments rely on the respective reference implementations for the corresponding GAN model .;Used Software , Datasets , Pretrained Models , and Implementations;67
26519;0e8753f550350e53824358ca3f0f8cfd2f2dc2f7;Material;1;;;MovieLens 10 M matrix;After a row and column permutation , the original MovieLens 10 M matrix is partitioned in blocks , where is the matrix that we use for our experiments ( Figure [ reference ] ) .;The resulting matrix has observed values that correspond to the ratings that a user has given to a movie .;We treat as the users feature matrix , as the movies feature matrix and discard the remaining matrix .;Movielens dataset;9
26901;0ecd4fdce541317b38124967b5c2a259d8f43c91;Material;0;;;Infinite Mario;Each year new domains are proposed , including standard RL benchmarks , Tetris , and Infinite Mario .;Starting in 2004 as a conference workshop , the Reinforcement Learning competition was held until 2009 ( a new iteration of the competition has been announced for 2013 ) .;In a typical competition domain , the agent ’s state information is summarized through a series of high - level state variables rather than direct sensory information .;Evaluation Frameworks for General Agents;34
57579;2393447b8b0b79046afea1c88a8ed3949338949e;Material;0;;;NarrativeQA KociskySBDHMG18;NarrativeQA KociskySBDHMG18 proposed a dataset about stories or summaries of books or movie scripts .;Many of the answers are long and relatively far from the source documents compared with those from MS MARCO .;The documents are long , averaging 62 , 528 ( 659 ) words in stories ( summaries ) , while the answers are relatively short , averaging 4.73 words .;RC with NLG .;45
107161;45fdc73a239e9c6ea65e98c96f6a2d6dc35d6f72;Material;1;;;TIMIT dataset;The conducted experiments on the TIMIT dataset yielded a phoneme error rate ( PER ) of % for QCNNs which is significantly lower than the PER obtained with real - valued CNNs ( % ) , with the same input features .;The hypothesis tested here is whether these advantages lead to better generalization .;Moreover , from a practical point of view , the resulting networks have a considerably smaller memory footprint due to a smaller set of parameters .;Introduction;1
40685;16cd50316e41cbb1d9dfeafeb524b31654cef37a;Material;0;;;in - domain training set;The RNN - LM output vocabulary consists of all words occurring more than once in the in - domain training set .;Training used noise - contrastive estimation ( NCE ) .;While the RNN - LM estimates a probability for unknown words , we take a different approach in rescoring : The number of out - of - set words is recorded for each hypothesis and a penalty for them is estimated for them when optimizing the relative weights for all model scores ( acoustic , LM , pronunciation ) , using the SRILM nbest - optimize tool .;RNN - LM setup;10
75013;2f92b10acf7c405e55c74c1043dabd9ded1b1800;Material;1;;;MultiNLI;We test on both the SNLI dataset Bowman2015 , a collection of sentence pairs , and the more recent MultiNLI dataset ( sentence pairs ) williams2017broad .;;Given two sentences , a premise and a hypothesis , the task is to determine whether either entails , contradicts or is neutral to .;Recognizing Textual Entailment;9
1831;0116899fce00ffa4afee08b505300bb3968faf9f;Material;1;;;Chinese Poems;For real data , we use the text in EMNLP2017 WMT News , COCO Image Caption and Chinese Poems as the long , mid - length and short text corpus , respectively .;For synthetic data , LeakGAN obtains much lower negative log - likelihood than previous models with sequence length set to 20 and 40 .;In all those cases , LeakGAN shows significant improvements compared to previous models in terms of BLEU statistics and human Turing test .;Introduction;2
91237;3b1b94441010615195a5c404409ce2416860508c;Material;0;;;image and sentences;Recently , Socher et al . used neural networks to co - embed image and sentences together and Karpathy et al . co - embedded image crops and sub - sentences .;Similarly , posed the task as a retrieval problem , but based on co - embedding of images and text in the same space .;Attributes have been used in many image captioning methods to fill the gaps in predetermined caption templates .;Image Captioning;4
90762;3a7895b17db0cda7bbf86bcda52c46a3e03b6ded;Material;1;;;AVEC dataset;As both IEMOCAP and AVEC dataset contain multimodal information , we have evaluated DialogueRNN on multimodal features as used and provided by hazarika - EtAl:2018:N18 - 1 hazarika - EtAl:2018:N18 - 1 .;;We use concatenation of the unimodal features as a fusion method by following hazarika - EtAl:2018:N18 - 1 hazarika - EtAl:2018:N18 - 1 , since fusion mechanism is not a focus of this paper .;Multimodal Setting;43
91196;3b1b94441010615195a5c404409ce2416860508c;Material;0;;;external knowledge;The image description takes the form of a set of captions , and the external knowledge is text - based information mined from a Knowledge Base .;( See Figure [ reference ] ) .;Specifically , for each of the top - attributes detected in the image we generate a query which may be applied to a Resource Description Framework ( RDF ) KB , such as DBpedia .;Introduction;1
65667;2a69ddbafb23c63e5e22401664bea229daaeb7d6;Material;1;;;DUT - OMRON dataset;The Res2Net based approach achieves greatest performance gain on the DUT - OMRON dataset , since this dataset contains the most significant object size variation than the other three datasets .;On the DUT - OMRON dataset ( containing 5168 images ) , the Res2Net based model has a improvement on F - measure and a improvement on MAE , compared with ResNet based model .;Some visual comparisons of salient object detection results on challenging examples are illustrated in Fig .;Salient Object Detection;26
91198;3b1b94441010615195a5c404409ce2416860508c;Material;0;kein dataset;;RDF ) KB;Specifically , for each of the top - attributes detected in the image we generate a query which may be applied to a Resource Description Framework ( RDF ) KB , such as DBpedia .;The image description takes the form of a set of captions , and the external knowledge is text - based information mined from a Knowledge Base .;RDF is the standard format for large KBs , of which there are many .;Introduction;1
67338;2aec8d465e9a74c27f956ed1136f3e8a3ba0a833;Material;0;;;AWGN - like noise;It can be seen that CDnCNN - B yields very pleasing results for noisy image with AWGN - like noise such as image;[ reference ] shows the denoising results of Noise Clinic , CBM3D , CDnCNN - B and FFDNet on five color noisy images from RNI15 .;“ Frog ” , and is still unable to handle non - AWGN noise .;Experiments on Real Noisy Images;18
62030;26fe009b958e8728382d9d764bd7153632f0b869;Material;1;;;Multi - NLI test sets;Finally , Table [ reference ] shows results for different encoders on SNLI and Multi - NLI test sets .;These ablation results are shown in Tables [ reference ] , [ reference ] , [ reference ] and [ reference ] , all based on the Multi - NLI development sets .;First , Table [ reference ] shows the performance changes for different number of biLSTM layers and their varying dimension size .;Ablation Analysis Results;9
103379;43428880d75b3a14257c3ee9bda054e61eb869c0;Material;1;;;WMT'16;The translations produced by our models often match the length of the references , particularly for the large WMT'14 English - French task , or are very close for small to medium data sets such as WMT'14 English - German or WMT'16 English - Romanian .;We did not use the exact same vocabulary size because word pieces and BPE estimate the vocabulary differently .;;5;17
93760;3d734edc41c13fb4da2c3709e8255b004d083962;Material;1;;;BSD200;Following FSRCNN , SRCNN and SCN , we use three dataset , i.e. Set5 ( 5 images ) , Set14 ( 14 images ) and BSD200 ( 200 images ) for testing , which are widely used for benchmark in other works .;We set the patch size as , and use data augmentation ( rotation or flip ) to prepare training data .;;Datasets for Training and Testing;6
59344;23f5854b38a15c2ae201e751311665f7995b5e10;Material;1;;;Pinterest;The authors kindly provided the two datasets ( ML - 1 M and Pinterest ) used in the original paper , as well as the training / test split , therefore we separately compare with ncf on these two relatively smaller datasets in the empirical study .;We use the publicly available source code provided by the authors , yet can not obtain competitive performance on the datasets used in this paper - the validation metrics drop within the first few epochs over a wide range of regularization parameters .;In particular , we compare with the hybrid NeuCF model which gives the best performance in He et al .;Baselines;17
98861;40eb1e54cb5382dfd3b7efd16dc7df826262ea52;Material;0;;;RGB images;Therefore , we leverage mature 2D object detector to propose 2D object regions in RGB images as well as to classify objects .;The resolution of data produced by most 3D sensors , especially real - time depth sensors , is still lower than RGB images from commodity cameras .;With a known camera projection matrix , a 2D bounding box can be lifted to a frustum ( with near and far planes specified by depth sensor range ) that defines a 3D search space for the object .;Frustum Proposal;7
101583;424aef7340ee618132cc3314669400e23ad910ba;Material;1;;;Wikitext - 2;We set γ to values between 0.5 and 0.8 for the PTB dataset , and between 1.0 and 1.5 for the Wikitext - 2 dataset .;We have empirically observed that setting α , the weight of the augmented loss , according to α = γτ for all the networks works satisfactorily .;We would like to note that we have not observed sudden deteriorations in the performance with respect to moderate variations in either τ or α .;APPENDIX A MODEL AND TRAINING DETAILS;11
67201;2aec8d465e9a74c27f956ed1136f3e8a3ba0a833;Material;1;;;Clip300 dataset;To evaluate FFDNet - Clip , Table [ reference ] shows the PSNR comparison with DCGRF and RBDN on the Clip300 dataset .;Overall , FFDNet produces the best perceptual quality of denoised images .;It can be seen that FFDNet - Clip with matched noise level achieves better performance than DCGRF and RBDN , showing that FFDNet performs well under the clipping setting .;Experiments on AWGN Removal;15
86643;36c3972569a6949ecca90bfa6f8e99883e092845;Material;1;;;VQA 2.0;As can be seen in Table [ reference ] , with features from 100 bounding - boxes , we reach 70.01 % for test - dev and 70.24 % for test - std on VQA 2.0 .;Instead of using an adaptive protocol for choosing the number of object proposals ( between 10 and 100 ) per image as as done in , we also experimented with using a simpler ( but slower ) strategy of using 100 objects proposals for all images .;;Post - Challenge Improvements;7
69023;2c761495cf3dd320e229586f80f868be12360d4e;Material;1;;;FastEval14k benchmark;On FastEval14k benchmark , model trained from ImageNet initialization performs better at the first 15 M iterations , but then becomes on par with random initialization .;Figure [ reference ] shows the training progress for these two settings .;Please note that the full training schedule takes 90 M iterations or around 10 epochs .;Monitoring Training Progress;6
47652;1c7e078611c9df412e6eb3a356f31a0da0c1f99c;Material;0;;;Amazon Picking Challenge;Recently , the 6D object pose estimation problem has received more attention thanks to the competition in the Amazon Picking Challenge ( APC ) .;In this work , we combine the advantages of both template - based methods and feature - based methods in a deep learning framework , where the network combines bottom - up pixel - wise labeling with top - down object pose regression .;Several datasets and approaches have been introduced for the specific setting in the APC .;RELATED WORK;2
3664;020a9aba95bce75dca08e3c499efc9e100f1cbb6;Material;1;;;Atari games domain;In this paper , we consider the challenging Atari games domain , which requires processing raw pixel inputs and delayed rewards .;Hence , exploration in complex domains is often performed with simple epsilon - greedy methods .;We evaluate several more sophisticated exploration strategies , including Thompson sampling and Boltzman exploration , and propose a new exploration method based on assigning exploration bonuses from a concurrently learned model of the system dynamics .;Incentivizing Exploration In Reinforcement Learning With Deep Predictive Models;0
67411;2aec8d465e9a74c27f956ed1136f3e8a3ba0a833;Material;1;;;AWGN;The results on synthetic images with AWGN demonstrated that FFDNet can not only produce state - of - the - art results when input noise level matches ground - truth noise level , but also have the ability to robustly control the trade - off between noise reduction and detail preservation .;To achieve this goal , several techniques were utilized in network design and training , such as the use of noise level map as input and denoising in downsampled sub - images space .;The results on images with spatially variant AWGN validated the flexibility of FFDNet for handing inhomogeneous noise .;Conclusion;20
12970;072fd0b8d471f183da0ca9880379b3bb29031b6a;Material;1;;;aerial photos;The aerial photos generated by our method fooled participants on of trials , significantly above the L1 baseline , which produces blurry results and nearly never fooled participants .;Results of our AMT experiment for map photo are given in Table [ reference ] .;In contrast , in the photo map direction our method only fooled participants on % of trials , and this was not significantly different than the performance of the L1 baseline ( based on bootstrap test ) .;Perceptual validation;14
54222;218b80da3eb15ae35267d280dcc4a806d515334a;Material;1;kein dataset;;native data;Fluency boost learning fully exploits both error - corrected data and native data by generating diverse error - corrected sentence pairs during training , which benefits model learning and improves the performance over the base seq2seq model , while fluency boost inference utilizes the characteristic of GEC to progressively improve a sentence ’s fluency through round - way correction .;We present a state - of - the - art convolutional seq2seq model based GEC system that uses a novel fluency boost learning and inference mechanism .;The powerful learning and inference mechanism enables our system to achieve state - of - the - art results and reach human - level performance on both CoNLL - 2014 and JFLEG benchmark datasets .;Conclusion;16
12425;07045f87709d0b7b998794e9fa912c0aba912281;Material;1;wegen section;;PhC - U373 ”;PhC - U373 ” contains Glioblastoma - astrocytoma U373 cells on a polyacrylimide substrate recorded by phase contrast microscopy ( see [ reference ] a , b and Supp .;The first data set “;Material ) .;Experiments;5
81762;3526555fa0178c101ee9896252c818f9e03532a5;Material;1;;;Tobacco - 3482 dataset;Secondly , we use the Tobacco - 3482 dataset to evaluate the performance of the deep s and to investigate to which extent transfer learning from the first dataset is applicable .;The dataset is already split into a training dataset which contains images and a validation and a test dataset which each contain images .;The Tobacco - 3482 dataset contains images from ten document classes .;Datasets;12
16121;09da677bdbba113374d8fe4bb15ecfbdb4c8fe40;Material;1;;;ImagNet - 1k;Extensive experiments on three benchmark datasets , ImagNet - 1k , Places365 and PASCAL VOC , clearly demonstrate superior performance of the proposed DPN over state - of - the - arts .;To enjoy the benefits from both path topologies , our proposed Dual Path Network shares common features while maintaining the flexibility to explore new features through dual path architectures .;In particular , on the ImagNet - 1k dataset , a shallow DPN surpasses the best ResNeXt - 101;Dual Path Networks;0
33114;1109b663453e78a59e4f66446d71720ac58cec25;Material;0;;;1000 - category ImageNet;However , the advent of larger datasets has enabled ConvNets to significantly advance the state of the art on datasets such as the 1000 - category ImageNet .;The accuracy of ConvNets on small datasets such as Caltech - 101 , while decent , has not been record - breaking .;The main advantage of ConvNets for many such tasks is that the entire system is trained end to end , from raw pixels to ultimate categories , thereby alleviating the requirement to manually design a suitable feature extractor .;Introduction;1
75302;30180f66d5b4b7c0367e4b43e2b55367b72d6d2a;Material;0;;;YouTubeFaces;The top performing approaches for face verification on Labeled Faces in the Wild and YouTubeFaces are all based on convolutional networks .;;VGG - Face is the application of the VGG - 16 convolutional network architecture trained on a newly curated dataset of 2.6 M images of 2622 subjects .;Related Work;2
84302;360cfa09b2f7c8e10b1831d899c5a51aefa1883e;Material;0;;;TED - talk corpus;The optimization was done using the Adaptive Moment Estimation ( Adam ) algorithm running for 22 epochs ( 35 for the TED - talk corpus ) with , , .;Moreover , the sorting approach exploits a curriculum learning strategy that has been shown to slightly improve the performance and to ensure numerical stability of gradients .;The performance on the development set was monitored after each epoch , while the learning rate was halved when the performance improvement went below a certain threshold ( ) .;RNN setting;10
83389;35c1668dc64d24a28c6041978e5fcca754eb2f4b;Material;1;;;IWSLT 2014 evaluation campaign;We use data from the German - English machine translation track of the IWSLT 2014 evaluation campaign cettolo2014 .;For the translation task , our generative model is an LSTM with hidden units and it uses the same attentive encoder architecture as the one used for summarization .;The corpus consists of sentence - aligned subtitles of TED and TEDx talks .;Machine Translation;13
76554;303fef411f235e6d1125a40af1e93224f498a4d5;Material;1;;;heldout - 30;For test , we use another three shards from the heldout set , namely [ heldout - 20 , heldout - 30 , heldout - 40 ] .;For validation , we use two shards from the heldout set , namely [ heldout - 00 , heldout - 10 ] .;The hyper - parameters are listed below .;1B Word Dataset;30
40668;16cd50316e41cbb1d9dfeafeb524b31654cef37a;Material;1;;;Web ) data;In order to make use of LM training data that is not fully matched to the target conversational speech domain , we start RNN - LM training with the union of in - domain ( here , CTS ) and out - of - domain ( e.g. , Web ) data .;The two RNN - LMs and the N - gram LM for each direction are interpolated with weights of ( 0.375 , 0.375 , 0.25 ) .;Upon convergence , the network undergoes a second training phase using the in - domain data only .;RNN - LM setup;10
104011;435259c5f3cffd75ef837a8e638cc8f6244e25c4;Material;1;;;iSEG Grand Challenge;Comparing the proposed Early_Ensemble approach to the top - 5 ranked methods of the iSEG Grand Challenge , our approach achieved very competitive results , ranking first or second in most cases .;Via 3D convolutions , our approach captures spatial information in volumetric data , which is confirmed by a performance improvement over 2D CNN models .;A paired sample t - test showed that the difference between our approach and the other best ranked method in the challenge ( i.e. , MSL_SKKU ) is not statistically significant .;Discussion;19
41615;1751668492bac56f0ae2b6410417515ab3215945;Material;1;;;Penn Treebank WSJ corpus;In order to demystify the effects of adversarial training in the context of NLP , we conduct POS tagging experiments on multiple languages using the Penn Treebank WSJ corpus ( Englsih ) and the Universal Dependencies dataset ( 27 languages ) , with thorough analyses of the following points :;With a BiLSTM - CRF model as our baseline POS tagger , we apply adversarial training by considering perturbations to input word / character embeddings .;Effects on different target languages Vocabulary statistics and tagging accuracy Influence on downstream tasks Representation learning of words;Introduction;1
33369;1109b663453e78a59e4f66446d71720ac58cec25;Material;1;;;ILSVRC 2013 datasets;We applied it to the ILSVRC 2013 datasets , and it currently ranks 4 th in classification , 1 st in localization and 1 st in detection .;We have presented a multi - scale , sliding window approach that can be used for classification , localization and detection .;A second important contribution of our paper is explaining how ConvNets can be effectively used for detection and localization tasks .;Discussion;15
82097;35502af359aa60ae8047df172e29503cfb29c3f9;Material;0;;;JFT - 300 M dataset;While there are more complex methods in literature such as PSPNet and which augment training with additional data ( e.g. , COCO or JFT - 300 M dataset ) and utilize ensembles and post - processing , we focus on a simple experiment training the base model with / without the proposed pixel pair embedding loss to demonstrate the effectiveness .;Similar to our proposal detection model , we use a 64 - dimension embedding space on top of DeepLab - v3 as our base model .;In addition to reporting mean intersection over union ( mIoU ) over all classes , we also computed mIoU restricted to a narrow band of pixels around the ground - truth boundaries .;Semantic Instance Detection;15
77046;3112d2d95d66b3d54a72c55072647aab937e410e;Material;0;;;WEATHERGOV;Several benchmark datasets have been used in recent years for the text generation task , the most popular of these being WEATHERGOV [ reference ][ reference ][ reference ] . Recently , neural generation systems have show strong results on these datasets , with the system of [ reference ] achieving BLEU scores in the 60s and 70s on WEATHERGOV , and BLEU scores of almost 30 even on the smaller ROBOCUP dataset .;A dataset for training data - to - document systems typically consists of ( s , y 1:T ) pairs , where y 1:T is a document consisting of a gold ( i.e. , human generated ) summary for database s.;These results are quite promising , and suggest that neural models are a good fit for text generation .;Data - to - Text Datasets;3
2896;01959ef569f74c286956024866c1d107099199f7;Material;1;;;open - ended - real;Screenshots of leaderboards for open - ended - real and multiple - choice - real are shown in Fig . 13 .;| mc - abstract ] . 2 ) Compare their test - standard accuracies with those on the corresponding test2015 leaderboards [ oe - real - leaderboard | oe - abstract - leaderboard | mc - real - leaderboard | mcabstract - leaderboard ] . For more details , please see the challenge page [ reference ] .;We also compare the test - standard accuracies of our best model ( deeper LSTM Q + norm I ) for both open - ended and multiple - choice tasks ( real images ) with other entries ( as of October 28 , 2016 ) on the corresponding leaderboards in Table 5 .;VQA CHALLENGE AND WORKSHOP;17
