;doc_id;relation;used;used_Felix;Anmerkung;ner;sentence;pre_sentence;post_sentence;section_name;section_index
56420;231af7dc01a166cac3b5b01ca05778238f796e41;Material;na;;;Images;Images with meaningful objects are supposed to have low label ( output ) entropy , that is , they belong to few object classes .;Generated samples are fed into an inception model that was trained on ImageNet .;On the other hand , the entropy across images should be high , that is , the variance over the images should be large .;Performance Measure .;8
21540;0be9ca65ad318ee3729928882ef2c403d4b6d24e;Material;0;;;preprocessed PTB;/ MerityXBS16 respectively published preprocessed PTB and WikiText - 2 datasets .;journals / corr;Table [ reference ] describes their statistics .;Datasets;6
87600;37a18be8c599b781cc28b6a62d8f11e8a6a75169;Material;0;;;BraTS 2018 training dataset;This year , BraTS 2018 training dataset included 285 cases ( 210 HGG and 75 LGG ) , each with four 3D MRI modalities ( T1 , T1c , T2 and FLAIR ) rigidly aligned , resampled to 1x1x1 mm isotropic resolution and skull - stripped .;Multimodal Brain Tumor Segmentation Challenge ( BraTS ) aims to evaluate state - of - the - art methods for the segmentation of brain tumors by providing a 3D MRI dataset with ground truth tumor segmentation labels annotated by physicians .;The input image size is 240x240x155 .;Introduction;1
77998;31e5dab321066712cdc8b30943f7950066840ee1;Material;1;;;LDC2015E86 dataset;Table [ reference ] shows the comparison on the development split of the LDC2015E86 dataset between sequential , tree and graph encoders .;We first evaluate the overall performance of the models , after which we focus on two phenomena that we expect to benefit most from structural encoders : reentrancies and long - range dependencies .;The sequential encoder ( Seq ) is a re - implementation of konstas2017neural .;Experiments;13
73289;2e57bccb74bcb46cbc5b4225b62679023ed1f9da;Material;0;oder 1 wegen Abstract?;;structured Graph Reachability dataset;ReasoNets achieve superior performance in machine comprehension datasets , including unstructured CNN and Daily Mail datasets , the Stanford SQuAD dataset , and a structured Graph Reachability dataset .;With the use of reinforcement learning , ReasoNets can dynamically determine whether to continue the comprehension process after digesting intermediate results , or to terminate reading when it concludes that existing information is adequate to produce an answer .;;ABSTRACT;1
27738;0f0a25d3be0d50a134f6f68e6a82bd8a2f668882;Material;na;;;Photo;( c ) ) , henceforth referred to as Switch , that determines the depiction style of the input image and passes the image to corresponding depiction sub - network ( Photo or Art ) .;To realize the switching mechanism mentioned in Section [ reference ] , we design and train a switch network ( see Figure [ reference ];The Switch has two convolution layers which capture depiction - discriminative features such as edges , textures , corners , colors and their conjunctions .;Switch;5
86628;36c3972569a6949ecca90bfa6f8e99883e092845;Material;1;;;VisDial datasets;Since both VG and VisDial datasets only have a single ground - truth answer while VQA has 10 , we simply replicated the answer to each question in VG and VisDial 10 times to make the data format compatible with the VQA evaluation protocol .;For VisDial , we converted the 10 turns in a dialog to 10 independent question - answer pairs .;We also performed additional data augmentation by mirroring the images in the VQA dataset .;Data Augmentation;6
72691;2e10643c3759f97b673ff8c297778c0b6c20032b;Material;1;;;SogouCA;This dataset is a combination of the SogouCA and SogouCS news corpora , containing in total 2 , 909 , 551 news articles in various topic channels .;Sogou news corpus .;We then labeled each piece of news using its URL , by manually classifying the their domain names .;Large - scale Datasets and Results;11
103880;435259c5f3cffd75ef837a8e638cc8f6244e25c4;Material;na;;;iSEG - 2017 organizers;The manual labels were prepared by the iSEG - 2017 organizers .;;Instead of starting from scratch , an initial automatic segmentation for 6 - month subjects was generated with the guidance from follow - up 24 - month scans with high tissue contrast , using the publicly - available iBEAT tool .;Ground truth generation;12
44476;1a5ea605111eb3403868d4b679315e944beee8c6;Material;1;;;monolingual News corpus;We experimented with using automatic back - translations of the monolingual News corpus as additional training data , pervasive dropout , and target - bidirectional models .;Our systems are based on an attentional encoder - decoder , using BPE subword segmentation for open - vocabulary translation with a fixed vocabulary .;All reported methods give substantial improvements , and we see improvements of 4.3–11.2 Bleu over our baseline systems .;Edinburgh Neural Machine Translation Systems for WMT 16;0
43557;19fd2c2c9d4eecb3cf1befa8ac845a860083e8e7;Material;1;;;Pong;We selected hyperparameter values by performing an informal search on the games of Breakout , Pong and Seaquest which were then fixed for all the games .;The random agent selected actions uniformly at random at 10Hz and it was evaluated using the same starting states as the agents for both kinds of evaluations ( null op starts and human starts ) .;We have trained Gorila DQN 5 times on each game using the same fixed hyperparameter settings and random network initializations .;Evaluation;12
55920;22aab110058ebbd198edb1f1e7b4f69fb13c0613;Material;1;;;Google TPU v3 Pod;We train on a Google TPU v3 Pod , with the number of cores proportional to the resolution : 128 for 128 128 , 256 for 256 256 , and 512 for 512 512 .;Spectral Normalization miyato2018spectral is used in both G and D , following SA - GAN zhang2018sagan .;Training takes between 24 and 48 hours for most models .;Experimental Details;18
103135;43428880d75b3a14257c3ee9bda054e61eb869c0;Material;0;;;WMT'14 English - French;WMT'14 English - French .;As vocabulary we use 40 K sub - word types based on BPE .;We use the full training set of 36 M sentence pairs , and remove sentences longer than 175 words as well as pairs with a source / target length ratio exceeding 1.5 .;3;13
40674;16cd50316e41cbb1d9dfeafeb524b31654cef37a;Material;na;;;in - domain data;Because the size of the out - of - domain data is a multiple of the in - domain data , a standard training on a simple union of the data would not yield a well - matched model , and have poor perplexity in the target domain .;Both training phases use in - domain validation data to regulate the learning rate schedule and termination .;We found best results with an RNN - LM configuration that had a second , non - recurrent hidden layer .;RNN - LM setup;10
32066;10a36dea0167511b66deca65fdca978aa9afdb11;Material;1;;;COCO val2014;To generate the training set and validation set for our model , we first randomly split the images of COCO val2014 into 70 % subset A and 30 % subset B. To avoid potential overfitting , questions sharing the same image will be placed into the same split .;Here train2014 and val2014 are the standard splits of the image set in the COCO dataset .;The question - answer pairs from the images of COCO train2014 + val2014;Experiments;3
107756;46018a894d533813d67322827ca51f78aed6d59e;Material;0;;;BRATS’13;The ground truth for the rest of the training brains is generated by a voted average of segmented results of the top performing methods in BRATS’13 and BRATS’12 .;BRATS’15 contains the training data of 2013 .;Some of these automatically generated ground truths have been refined manually by a user .;Cascaded architectures;15
107674;46018a894d533813d67322827ca51f78aed6d59e;Material;0;;;BRATS 2014 dataset;Please note that we could not use the BRATS 2014 dataset due to problems with both the system performing the evaluation and the quality of the labeled data .;As mentioned before during the first phase training , the distribution of examples introduced to the model from all 5 classes is uniform .;For these reasons the old BRATS 2014 dataset has been removed from the official website and , at the time of submitting this manuscript , the BRATS website still showed : “ Final data for BRATS 2014 to be released soon ” .;Experiments and Results;13
15514;08d55271589f989d90a7edce3345f78f2468a7e0;Material;1;;;YouTube Face Database;For face verification , we train our base model on extended version of VGG Face dataset , in which we extend the identity number from 2.6 K to 90 K and image number from 2.6 M to 5M. The model is evaluated on YouTube Face Database and IARPA Janus Benchmark A ( IJB - A ) dataset .;Datasets .;YouTube Face contains 3425 videos of 1595 identities .;Unconstrained face verification;13
48629;1d5d0a41b720bc51fd568cf78f8aa4ec5af4f802;Material;1;;;Car only;Table [ reference ] shows the results on models that are trained on Car only , with the exception of final ( all - class ) , which is trained on all categories , and Table [ reference ] shows the results of models that are trained on all categories .;We use the official evaluation protocol for the KITTI dataset , i.e. , the 3D IoU thresholds are 0.7 , 0.5 , 0.5 for Car , Cyclist , Pedestrian respectively .;;3D Localization AP in KITTI;27
27032;0ecd4fdce541317b38124967b5c2a259d8f43c91;Material;na;;;Atari 2600 game programmers;Atari 2600 game programmers often used these bits not as individual values , but as part of 4 - bit or 8 - bit words .;The first part of the generated feature vector simply includes the 1024 bits of RAM .;Linear function approximation on the individual bits can capture the value of these multi - bit words .;RAM - based Feature Generation;42
87377;372bc106c61e7eb004835e85bbfee997409f176a;Material;0;;;MNIST digits;We resized them to have the same resolution as the MNIST digits .;The USPS digits have a different resolution .;We employed the CoGAN used for the digit generation task .;Applications;5
54073;218b80da3eb15ae35267d280dcc4a806d515334a;Material;1;;;public Lang - 8 Corpus;As previous studies ji2017nested , we use the public Lang - 8 Corpus mizumoto2011mining , tajiri2012tense , Cambridge Learner Corpus ( CLC ) nicholls2003cambridge and NUS Corpus of Learner English ( NUCLE ) dahlmeier2013building as our original error - corrected training data .;;Table [ reference ] shows the stats of the datasets .;Dataset and evaluation;12
2857;01959ef569f74c286956024866c1d107099199f7;Material;1;;;VQA test - dev;Table 4 shows the accuracy of different ablated versions of our best model ( deeper LSTM Q + norm I ) for both the openended and multiple - choice tasks on the VQA test - dev for real images .;It is interesting to see that the relative proportions of different age groups is consistent across all accuracy bins with questions belonging to the age group 5 - 8 comprising the majority of the predictions which is expected because 5 - 8 is the most common age group in the dataset ( see Fig . 7 ) .;The different ablated versions are as follows - 1 );Results;15
21832;0c278ecf472f42ec1140ca2f1a0a3dd60cbe5c48;Material;1;;;Atari 2600 games;Finally , we extend these ideas to a deep RL algorithm and show that it achieves state - of - the - art performance in Atari 2600 games .;We use this result to introduce an algorithm that performs as well as some theoretically sample - efficient approaches .;Count - BasedExplorationwiththeSuccessorRepresentation;Title;0
44594;1a5ea605111eb3403868d4b679315e944beee8c6;Material;1;;;Russian data;We apply the Latin BPE operations to the English data ( training data and input ) , and both the Cyrillic and Latin BPE operations to the Russian data .;We thus follow the approach described in , first mapping the Russian text into Latin characters via ISO - 9 transliteration , then learning the BPE operations on the concatenation of the English and latinized Russian training data , then mapping the BPE operations back into Cyrillic alphabet .;Translation results are shown in Table [ reference ] .;English Russian;12
45610;1abf6491d1b0f6e8af137869a01843931996a562;Material;0;;;SiftFlow;pool6 , it instantly helps improve by about , which means that context is useful here as opposed to the observation in SiftFlow .;As shown in Table [ reference ] , by adding global context;Context becomes more important proportionally to the image size .;Combining Local and Global Features;9
82811;357776cd7ee889af954f0dfdbaee71477c09ac18;Material;na;;;TFD;A video showing the learnt TFD manifold can be found at .;shows samples drawn from the adversarial autoencoder trained on these datasets .;To determine whether the model is over - fitting by copying the training data points , we used the last column of these figures to show the nearest neighbors , in Euclidean distance , to the generative model samples in the second - to - last column .;Likelihood Analysis of Adversarial Autoencoders;7
56509;231af7dc01a166cac3b5b01ca05778238f796e41;Material;1;;;LSUN Bedrooms dataset;We test TTUR for the deep convolutional GAN ( DCGAN ) at the CelebA , CIFAR - 10 , SVHN and LSUN Bedrooms dataset .;;Fig .;DCGAN on Image Data .;11
59253;23f5854b38a15c2ae201e751311665f7995b5e10;Material;0;;;Netflix;Netflix Prize ( Netflix ) :;We only keep users who have watched at least five movies .;This is the user - movie ratings data from the Netflix Prize 7 .;Datasets;14
40863;16cd50316e41cbb1d9dfeafeb524b31654cef37a;Material;na;;;laughter;The phonetic inventory includes special models for noise , vocalized - noise , laughter and silence .;Additionally , we have trained several models with 27k tied states .;We use a 30k - vocabulary derived from the most common words in the Switchboard and Fisher corpora .;Acoustic Model Details;21
53854;2116b2eaaece4af9c28c32af2728f3d49b792cf9;Material;1;;;ImageNet with dropout;Our model for ImageNet with dropout is a CNN which is trained on patches randomly extracted from the images , as well as their horizontal reflections .;;This is a form of data augmentation that reduces the network;Models for ImageNet;21
54980;223319a93dcf3912bbc1e5f949e5ab4d53906e62;Material;1;;;Amazon Webcam scenario;Under this transductive setting , our method is able to improve previously - reported state - of - the - art accuracy for unsupervised adaptation very considerably ( Table [ reference ] ) , especially in the most challenging Amazon Webcam scenario ( the two domains with the largest domain shift ) .;Unlike those works and similarly to e.g. DLID we use the whole unlabeled target domain ( as the premise of our method is the abundance of unlabeled data in the target domain ) .;;Results;8
99970;41d08fb733f3e50ac183490f84d6377dffccf350;Material;0;;;3D data;That is why the majority of extant works on using deep nets for 3D data resort to either volumetric grids or collections of images ( 2D views of the geometry ) .;Reconstructed 3D point cloud for weight sharing , etc .;Such representations , however , lead to difficult trade offs between sampling resolution and net efficiency .;Input;3
103720;435259c5f3cffd75ef837a8e638cc8f6244e25c4;Material;1;;;iSEG - 2017 Grand Challenge;iSEG - 2017 Grand Challenge on 6 - month infant brain MRI Segmentation .;We report evaluations of our method on the publicly available data of the MICCAI;We obtained very competitive results among 21 teams , ranking first and second in most metrics .;Contributions and outline;3
54930;223319a93dcf3912bbc1e5f949e5ab4d53906e62;Material;1;;;Syn Numbers;The latter ( Syn Numbers ) consists of 500 , 000 images generated by ourselves from Windows fonts by varying the text ( that includes different one - , two - , and three - digit numbers ) , positioning , orientation , background and stroke colors , and the amount of blur .;To address a common scenario of training on synthetic data and testing on real data , we use Street - View House Number dataset SVHN as the target domain and synthetic digits as the source .;The degrees of variation were chosen manually to simulate SVHN , however the two datasets are still rather distinct , the biggest difference being the structured clutter in the background of SVHN images .;Results;8
96968;3febb2bed8865945e7fddc99efd791887bb7e14f;Material;0;;;crowd sourced question - answer pairs;Rajpurkar2016SQuAD10 contains 100K + crowd sourced question - answer pairs where the answer is a span in a given Wikipedia paragraph .;Question answering The Stanford Question Answering Dataset ( SQuAD );"Our baseline model ClarkAdvancingRC is an improved version of the Bidirectional Attention Flow model in [ BiDAF ; ]";Evaluation;8
27891;0f0a25d3be0d50a134f6f68e6a82bd8a2f668882;Material;na;;;art;Current state - of - the - art object recognition architectures do achieve good performance but they are specialized for a single depiction style ( e.g. photos , sketches ) .;Human beings easily accomplish depiction - invariant recognition but machine - based systems are nowhere close to a similar level of performance .;Therefore , designing architectures which recognize objects regardless of depiction style can facilitate progress towards matching human - level abilities .;Introduction;1
97017;3febb2bed8865945e7fddc99efd791887bb7e14f;Material;1;;;CoNLL 2012 shared task Pradhan2012CoNLL2012ST;In our experiments with the OntoNotes coreference annotations from the CoNLL 2012 shared task Pradhan2012CoNLL2012ST , adding ELMo improved the average F by 3.2 % from 67.2 to 70.4 , establishing a new state of the art , again improving over the previous best ensemble result by 1.6 % F .;It uses a biLSTM and attention mechanism to first compute span representations and then applies a softmax mention ranking model to find coreference chains .;Named entity extraction;Evaluation;8
79149;32b36a9837da7eb19fb9e6bd85d48d38a81ff75f;Material;1;;;Extended Yale B dataset;"Regarding the more general task of learning invariant representations ; our results on the Extended Yale B dataset also demonstrate our model ’s ability to learn such representations .";;As expected , on the original representation the lighting conditions , , are well identifiable with almost perfect accuracy from both RF and LR .;Learning Invariant Representations;14
24624;0d24a0695c9fc669e643bad51d4e14f056329dec;Material;1;;;German - English machine translation track of the IWSLT 2014 evaluation campaign;For our first translation experiment , we use data from the German - English machine translation track of the IWSLT 2014 evaluation campaign cettolo2014report , as used in ranzato2015sequence , and closely follow the pre - processing described in that work .;;The training data comprises about 153 , 000 German - English sentence pairs .;Machine Translation;15
44481;1a5ea605111eb3403868d4b679315e944beee8c6;Material;1;;;English Czech;We participated in the WMT 2016 shared news translation task by building neural translation systems for four language pairs : English Czech , English German , English Romanian and English Russian .;;Our systems are based on an attentional encoder - decoder , using BPE subword segmentation for open - vocabulary translation with a fixed vocabulary .;Introduction;1
66972;2aec8d465e9a74c27f956ed1136f3e8a3ba0a833;Material;na;;;noises;Although the blind model performs favorably for synthetic AWGN removal without knowing the noise level , it does not generalize well to real noisy images whose noises are much more complex than AWGN ( see the results of DnCNN - B in Fig .;First , the generalization ability is different .;[ reference ] ) .;FFDNet vs. a Single Blind Model;10
59249;23f5854b38a15c2ae201e751311665f7995b5e10;Material;0;;;MovieLens - 20 M;MovieLens - 20 M ( ML - 20 M ) :;We study three medium - to large - scale user - item consumption datasets from various domains :;These are user - movie ratings collected from a movie recommendation service .;Datasets;14
72700;2e10643c3759f97b673ff8c297778c0b6c20032b;Material;0;;;Yelp reviews;Yelp reviews .;The fields we used for this dataset contain title and abstract of each Wikipedia article .;The Yelp reviews dataset is obtained from the Yelp Dataset Challenge in 2015 .;Large - scale Datasets and Results;11
22261;0c36c988acc9ec239953ff1b3931799af388ef70;Material;1;;;hard set;Our method achieves two 1th places and one 2nd place in three tasks over WIDER FACE validation dataset ( easy set , medium set , hard set ) .;Several techniques were employed including multi - scale training , multi - scale testing , light - designed RCNN , some tricks for inference and a vote - based ensemble method .;;Abstract;1
73437;2e57bccb74bcb46cbc5b4225b62679023ed1f9da;Material;0;;;CNN and Daily Mail dataset;Memory and Attention : The memory of the ReasoNet on CNN and Daily Mail dataset is composed of query memory and passage memory .;We use a shared GRU model for both query and passage .;M =;CNN and Daily Mail Datasets;7
79557;33a8d0a35390fde736744d4a0dd20dff7961c777;Material;0;;;bioinformatics;Graph Convolutional Neural Networks ( GCNNs ) are the most recent exciting advancement in deep learning field and their applications are quickly spreading in multi - cross - domains including bioinformatics , chemoinformatics , social networks , natural language processing and computer vision .;;In this paper , we expose and tackle some of the basic weaknesses of a GCNN model with a capsule idea presented in and propose our Graph Capsule Network ( GCAPS - CNN ) model .;Title;0
106052;4543052aeaf52fdb01fced9b3ccf97827582cef5;Material;1;;;300 - W dataset;In order to find appropriate choices of bit - widths , we try a series of bit - width combinations on the 300 - W dataset based on - DU - Net ( 4 ) .;Through network quantization , high precision operations and parameters can be efficiently represented by a few discrete values .;The performance and balance ability of these combinations on several methods are shown in Table [ reference ] , where DU - Net ( 4 ) is DU - Net with 4 blocks , BW and TW respectively represents binarized weight and ternarized weight without , BW - is binarized weight with float scaling factor , the suffix QIG means quantized inputs and gradients .;Evaluation of Network Quantization;14
48180;1cf6bc0866226c1f8e282463adc8b75d92fba9bb;Material;1;;;VQA dataset;The VQA dataset is a recent large dataset based on MS COCO .;;We use the full release ( V1.0 ) open - ended dataset , which contains a train set and a val set .;Results on VQA;12
83401;35c1668dc64d24a28c6041978e5fcca754eb2f4b;Material;1;;;tst2012;The test set is a concatenation of dev2010 , dev2012 , tst2010 , tst2011 and tst2012 which results in sentence pairs .;Our validation set comprises of sentence pairs which was taken from the training data .;The English dictionary has words while the German has words .;Machine Translation;13
88225;380b2c78d21ae6c43d418b6f0cb0222d5293d345;Material;1;;;Spanish Gigaword;"( 2015 ) ; for English and Chinese we used the same pretrained word embeddings as in Table [ reference ] , for German we used the monolingual training data from the WMT 2015 dataset and for Spanish we used the Spanish Gigaword version 3 .";We also include results with pretrained word embeddings for English , Chinese , German , and Spanish following the same training setup as Dyer et al .;See Table [ reference ] .;Experiments;7
97628;40193e7ba0fbd7153a1fe15e95563463b67c71f3;Material;na;;;"inthe - wild "" face image";"α * is the 3DMM ground truth , I is the input "" inthe - wild "" face image , and z is its latent representation .";where z * is the latent representation of a 3D annotated image J ,;The above self - critic loss encourages the model to output 3D faces that lie on the manifold of human faces , and predict landmarks that have the same distribution with the true facial landmarks .;Self - critic learning;12
47393;1c0e8c3fb143eb5eb5af3026eae7257255fcf814;Material;1;;;PASCAL VOC training;The WSDDNs are trained on the PASCAL VOC training and validation data by using fine - tuning on all layers , a widely - adopted technique to improve the performance of a CNN on a target domain [ reference ] . Here , however , fine tuning performs the essential function of learning the classification and detection streams , effectively causing the network to learn to detect objects , but using only weak image - level supervision .;"Note that this layer assesses the classification performance for the 20 classes together , but each of them is treated as a different binary classification problem ; the reason is that classes can co - occur in the PASCAL VOC , such that the softmax log loss used in AlexNet is not appropriate .";The experiments are run for 20 epochs and all the layers are fine - tuned with the learning rate 10 −5 for the first ten epochs and 10 −6 for the last ten epochs .;Experimental setup .;11
76178;303065c44cf847849d04da16b8b1d9a120cef73a;Material;1;;;iBUG;We trained the “ in - the - wild ” texture model on the images of iBUG , LFPW & AFW datasets as described in Sec .;To train our model , which we label as ITW , we use a variant of the Basel Face Model ( BFM ) that we trained to contain both identities drawn from the original BFM model along with expressions provided by .;[ reference ] using the 3D shape fits provided by .;Experiments;12
34886;139768cf7714beb9309efba734460f8562c60c78;Material;1;;;FCE;Grammatically correct text is needed as the starting point for inserting artificial errors , and we used two different sources : 1 ) the corrected version of the same FCE training set on which the system is trained ( 450 K tokens ) , and 2 ) example sentences extracted from the English Vocabulary Profile ( 270 K tokens ) .;We trained our error generation models on the public FCE training set [ reference ] and used them to generate additional artificial training data .;1 .;Evaluation;11
